[
  {
    "Version" : 1 ,
    "Key" : "37935_PC" ,
    "Type" : "PostalCode" ,
    "Rank" : 55 ,
    "LocalizedName" : "Beverly Hills" ,
    "EnglishName" : "Beverly Hills" ,
    "PrimaryPostalCode" : "90210" ,
    "Region" : {
      "ID" : "NAM" ,
      "LocalizedName" : "North America" ,
      "EnglishName" : "North America"
    } ,
    "Country" : {
      "ID" : "US" ,
      "LocalizedName" : "United States" ,
      "EnglishName" : "United States"
    } ,
    "AdministrativeArea" : {
      "ID" : "CA" ,
      "LocalizedName" : "California" ,
      "EnglishName" : "California" ,
      "Level" : 1 ,
      "LocalizedType" : "State" ,
      "EnglishType" : "State" ,
      "CountryID" : "US"
    } ,
    "TimeZone" : {
      "Code" : "PDT" ,
      "Name" : "America/Los_Angeles" ,
      "GmtOffset" : -7 ,
      "IsDaylightSaving" : true ,
      "NextOffsetChange" : null
    } ,
    "GeoPosition" : {
      "Latitude" : 34.1 ,
      "Longitude" : -118.42 ,
      "Elevation" : {
        "Metric" : {
          "Value" : "244" ,
          "Unit" : "m" ,
          "UnitType" : 5
        } ,
        "Imperial" : {
          "Value" : "800" ,
          "Unit" : "ft" ,
          "UnitType" : 0
        }
      }
    } ,
    "IsAlias" : false ,
    "SupplementalAdminAreas" : [
      {
        "Level" : 2 ,
        "LocalizedName" : "Los Angeles" ,
        "EnglishName" : "Los Angeles"
      }
    ]
  } , {
    "Version" : 1 ,
    "Key" : "407828_PC" ,
    "Type" : "PostalCode" ,
    "Rank" : 500 ,
    "LocalizedName" : "Oulu" ,
    "EnglishName" : "Oulu" ,
    "PrimaryPostalCode" : "90210" ,
    "Region" : {
      "ID" : "EUR" ,
      "LocalizedName" : "Europe" ,
      "EnglishName" : "Europe"
    } ,
    "Country" : {
      "ID" : "FI" ,
      "LocalizedName" : "Finland" ,
      "EnglishName" : "Finland"
    } ,
    "AdministrativeArea" : {
      "ID" : "14" ,
      "LocalizedName" : "Northern Ostrobothnia" ,
      "EnglishName" : "Northern Ostrobothnia" ,
      "Level" : 1 ,
      "LocalizedType" : "Region" ,
      "EnglishType" : "Region" ,
      "CountryID" : "FI"
    } ,
    "TimeZone" : {
      "Code" : "EEST" ,
      "Name" : "Europe/Helsinki" ,
      "GmtOffset" : 3 ,
      "IsDaylightSaving" : true ,
      "NextOffsetChange" : null
    } ,
    "GeoPosition" : {
      "Latitude" : 65.02 ,
      "Longitude" : 25.47 ,
      "Elevation" : {
        "Metric" : {
          "Value" : "0" ,
          "Unit" : "m" ,
          "UnitType" : 5
        } ,
        "Imperial" : {
          "Value" : "0" ,
          "Unit" : "ft" ,
          "UnitType" : 0
        }
      }
    } ,
    "IsAlias" : false ,
    "SupplementalAdminAreas" : [
    ]
  } , {
    "Version" : 1 ,
    "Key" : "236513_PC" ,
    "Type" : "PostalCode" ,
    "Rank" : 500 ,
    "LocalizedName" : "San Mateo Actipan" ,
    "EnglishName" : "San Mateo Actipan" ,
    "PrimaryPostalCode" : "90210" ,
    "Region" : {
      "ID" : "NAM" ,
      "LocalizedName" : "North America" ,
      "EnglishName" : "North America"
    } ,
    "Country" : {
      "ID" : "MX" ,
      "LocalizedName" : "Mexico" ,
      "EnglishName" : "Mexico"
    } ,
    "AdministrativeArea" : {
      "ID" : "TLA" ,
      "LocalizedName" : "Tlaxcala" ,
      "EnglishName" : "Tlaxcala" ,
      "Level" : 1 ,
      "LocalizedType" : "State" ,
      "EnglishType" : "State" ,
      "CountryID" : "MX"
    } ,
    "TimeZone" : {
      "Code" : "CDT" ,
      "Name" : "America/Mexico_City" ,
      "GmtOffset" : -5 ,
      "IsDaylightSaving" : true ,
      "NextOffsetChange" : null
    } ,
    "GeoPosition" : {
      "Latitude" : 19.62 ,
      "Longitude" : -98.6 ,
      "Elevation" : {
        "Metric" : {
          "Value" : "2571" ,
          "Unit" : "m" ,
          "UnitType" : 5
        } ,
        "Imperial" : {
          "Value" : "8436" ,
          "Unit" : "ft" ,
          "UnitType" : 0
        }
      }
    } ,
    "IsAlias" : false ,
    "SupplementalAdminAreas" : [
    ]
  }
]